{
  "image_id": "image",
  "diagram_type": "free_body",
  "arrows": [
    {
      "arrow_id": "arrow-01",
      "rgb": [
        77,
        162,
        227
      ],
      "bbox": [
        291,
        120,
        309,
        212
      ],
      "tail_xy": [
        300,
        212
      ],
      "head_xy": [
        300,
        120
      ],
      "angle_degrees": 89.7,
      "length_px": 92.0,
      "tail_spread_px": 1.97,
      "head_spread_px": 4.19,
      "confidence": 0.9,
      "label_text": "N",
      "label_confidence": 0.92,
      "primitive_ids": [
        "arrow.arrow.arrow-01"
      ]
    },
    {
      "arrow_id": "arrow-02",
      "rgb": [
        229,
        153,
        83
      ],
      "bbox": [
        150,
        246,
        240,
        264
      ],
      "tail_xy": [
        240,
        255
      ],
      "head_xy": [
        150,
        255
      ],
      "angle_degrees": 180.0,
      "length_px": 90.0,
      "tail_spread_px": 1.73,
      "head_spread_px": 4.24,
      "confidence": 0.9,
      "label_text": "f",
      "label_confidence": 0.92,
      "primitive_ids": [
        "arrow.arrow.arrow-02"
      ]
    },
    {
      "arrow_id": "arrow-03",
      "rgb": [
        50,
        164,
        89
      ],
      "bbox": [
        359,
        246,
        448,
        264
      ],
      "tail_xy": [
        359,
        255
      ],
      "head_xy": [
        448,
        254
      ],
      "angle_degrees": 0.3,
      "length_px": 89.0,
      "tail_spread_px": 1.71,
      "head_spread_px": 4.11,
      "confidence": 0.9,
      "label_text": "F",
      "label_confidence": 0.99,
      "primitive_ids": [
        "arrow.arrow.arrow-03"
      ]
    },
    {
      "arrow_id": "arrow-04",
      "rgb": [
        216,
        94,
        96
      ],
      "bbox": [
        291,
        299,
        309,
        350
      ],
      "tail_xy": [
        300,
        299
      ],
      "head_xy": [
        300,
        350
      ],
      "angle_degrees": 270.0,
      "length_px": 51.0,
      "tail_spread_px": 1.93,
      "head_spread_px": 2.82,
      "confidence": 0.9,
      "label_text": "W",
      "label_confidence": 0.96,
      "primitive_ids": [
        "arrow.arrow.arrow-04"
      ]
    }
  ],
  "regions": [
    {
      "region_id": "object",
      "kind": "box",
      "bbox": [
        240,
        210,
        360,
        300
      ],
      "pixel_count": 10809,
      "confidence": 0.95,
      "primitive_ids": [
        "arrow.rectangle.object"
      ]
    }
  ],
  "extraction_confidence": 0.9,
  "provenance": {
    "extractor_id": "arrow-v1",
    "extractor_version": "0.1.0",
    "backend": "color_component",
    "metadata_source": "none",
    "dependency_versions": {},
    "environment": {}
  },
  "gaps": [],
  "metadata": {
    "image_path": "datasets\\physics\\arrow-v1-noisy\\mutated\\noisy-mutated-05\\image.png"
  }
}