{
  "image_id": "image",
  "diagram_type": "free_body",
  "arrows": [
    {
      "arrow_id": "arrow-01",
      "rgb": [
        9,
        132,
        227
      ],
      "bbox": [
        291,
        120,
        309,
        210
      ],
      "tail_xy": [
        300,
        210
      ],
      "head_xy": [
        300,
        120
      ],
      "angle_degrees": 90.0,
      "length_px": 90.0,
      "tail_spread_px": 1.41,
      "head_spread_px": 3.84,
      "confidence": 0.9,
      "label_text": null,
      "label_confidence": 0.0,
      "primitive_ids": [
        "arrow.arrow.arrow-01"
      ]
    },
    {
      "arrow_id": "arrow-02",
      "rgb": [
        0,
        148,
        50
      ],
      "bbox": [
        359,
        197,
        428,
        257
      ],
      "tail_xy": [
        361,
        257
      ],
      "head_xy": [
        428,
        197
      ],
      "angle_degrees": 41.8,
      "length_px": 89.9,
      "tail_spread_px": 1.41,
      "head_spread_px": 3.88,
      "confidence": 0.9,
      "label_text": null,
      "label_confidence": 0.0,
      "primitive_ids": [
        "arrow.arrow.arrow-02"
      ]
    },
    {
      "arrow_id": "arrow-03",
      "rgb": [
        230,
        126,
        34
      ],
      "bbox": [
        150,
        246,
        240,
        264
      ],
      "tail_xy": [
        240,
        255
      ],
      "head_xy": [
        150,
        255
      ],
      "angle_degrees": 180.0,
      "length_px": 90.0,
      "tail_spread_px": 1.41,
      "head_spread_px": 3.85,
      "confidence": 0.9,
      "label_text": null,
      "label_confidence": 0.0,
      "primitive_ids": [
        "arrow.arrow.arrow-03"
      ]
    },
    {
      "arrow_id": "arrow-04",
      "rgb": [
        214,
        48,
        49
      ],
      "bbox": [
        291,
        300,
        309,
        390
      ],
      "tail_xy": [
        300,
        300
      ],
      "head_xy": [
        300,
        390
      ],
      "angle_degrees": 270.0,
      "length_px": 90.0,
      "tail_spread_px": 1.41,
      "head_spread_px": 3.84,
      "confidence": 0.9,
      "label_text": null,
      "label_confidence": 0.0,
      "primitive_ids": [
        "arrow.arrow.arrow-04"
      ]
    }
  ],
  "regions": [
    {
      "region_id": "object",
      "kind": "box",
      "bbox": [
        240,
        210,
        360,
        300
      ],
      "pixel_count": 10991,
      "confidence": 0.95,
      "primitive_ids": [
        "arrow.rectangle.object"
      ]
    }
  ],
  "extraction_confidence": 0.9,
  "provenance": {
    "extractor_id": "arrow-v1",
    "extractor_version": "0.1.0",
    "backend": "color_component",
    "metadata_source": "none",
    "dependency_versions": {},
    "environment": {}
  },
  "gaps": [],
  "metadata": {
    "image_path": "datasets\\physics\\arrow-v1\\mutated\\mutated-02\\image.png"
  }
}